{
  "$schema": "../../hirobius.tenant-metadata.schema.json",
  "slug": "accent-overlay",
  "displayName": "Accent Overlay",
  "tagline": "Accent-only semantic overlay on the lilac primitive ramp.",
  "tier": 2,
  "deployment": {
    "vercelProject": null,
    "primaryDomain": null,
    "previewDomain": null
  },
  "brand": {
    "primaryHex": "#6f3fd4",
    "accentName": "lilac",
    "logoPath": null
  },
  "legal": {
    "entity": null,
    "jurisdiction": null,
    "stripeAccountKind": null
  },
  "createdAt": "2026-07-06",
  "status": "scaffold",
  "_notes": [
    "Accent overlay aliases primitive.color.lilac.* (added to base tokens in the same change). Semantic tier only, per R1.",
    "Brand hex #6f3fd4 = primitive.color.lilac.500 (AA for white text on page + card surfaces)."
  ]
}
